퀴즈. 다낭은 스쿠터가 주요 교통수단으로 널리 사용된다,해설. 스쿠터는 다낭에서 가장 일반적으로 사용하는 교통수단이다
퀴즈. 다낭에는 택시 서비스가 잘 발달되어 있다,해설. 다낭에는 여러 택시 서비스가 운영되고 있어 편리하게 이용이 가능하다
퀴즈. 다낭의 대중교통으로 버스가 운영되고 있다,해설. 다낭에서는 다양한 노선의 버스가 운행되고 있어 대중교통을 이용할 수 있다
퀴즈. 다낭에서는 자전거를 대여할 수 있는 서비스가 있다.,해설. 자전거 대여 서비스가 있고 관광객들이 자전거를 이용해 시내를 돌아다닌다고 한다
퀴즈. 다낭의 해변 근처에는 산책로가 잘 조성되어 있다.,해설. 다낭의 해변 주변에는 잘 조성된 산책로가 있어 많은 사람들이 이용한다
퀴즈. 다낭에서 렌터카 서비스를 이용할 수 있다.,해설. 다낭에서는 차량을 렌트할 수 있는 서비스가 제공된다
퀴즈. 다낭은 공항과 시내를 연결하는 셔틀버스 서비스가 있다.,해설. 공항에서 시내로 이동할 수 있는 셔틀버스 서비스가 운영되고 있다
퀴즈. 다낭에는 케이블카가 있어 관광지까지 이동할 수 있다.,해설. 다낭에는 유명한 케이블카가 있으며 관광지인 바나 힐즈에 쉽게 접근할수 있다고 한다
퀴즈. 다낭의 교통수단으로 전기 스쿠터도 대여할 수 있다.,해설. 전기 스쿠터 대여서비스 또한 제공이 되며 환경 친화적인 교통수단으로 인기가 급상승하고 있다
퀴즈. 다낭의 시내에는 많은 오토바이 대여점이 있다.,해설. 다낭 시내 곳곳에 오토바이 대여할 수 있는 점포가 많이 분포되어 있다
